{
  "schema_version": "3.0",
  "id": "azure-container-apps",
  "name": "Azure Container Apps module fixture",
  "provider": "azure",
  "module_reference": {
    "name": "Azure/container-apps/azure",
    "source": "Azure/container-apps/azure",
    "registry": "https://registry.terraform.io/modules/Azure/container-apps/azure/latest",
    "upstream_note": "The public module deploys Azure Container Apps and related parameters."
  },
  "fixture_kind": "sanitized module-shaped terraform-show-json plan",
  "terraform_plan": "tfplan.json",
  "sboms": [
    "sboms/orders-api.cdx.json"
  ],
  "vulnerabilities": "../../common/vulnerabilities.json",
  "source_roots": {
    "orders-api": "source/orders-api"
  },
  "expected": {
    "resource_accounting_coverage": 1.0,
    "semantic_classification_coverage": 1.0,
    "artifact_match_coverage": 1.0,
    "min_findings": 2,
    "must_match_artifacts": [
      "orders-api"
    ],
    "required_resource_types": [
      "azurerm_container_app",
      "azurerm_container_app_environment",
      "azurerm_log_analytics_workspace",
      "azurerm_role_assignment",
      "azurerm_key_vault"
    ],
    "min_tier_by_finding": [
      {
        "artifact": "orders-api",
        "component": "lodash",
        "vulnerability": "CVE-2019-10744",
        "tier": "urgent"
      }
    ]
  },
  "notes": [
    "This fixture is reduced and sanitized. It models resource shapes emitted by common Terraform modules without vendoring module code.",
    "It asserts 100% resource accounting and semantic classification for the resources included in the pack."
  ]
}
